WELCOME TO ADDRESS BOOK SYSTEM - DATABASE PROBLEM !

UC1 :- Ability to create a Address Book Service Database

mysql> CREATE DATABASE addressbook_service;
Query OK, 1 row affected (0.59 sec)

mysql> show databases;
+---------------------+
| Database            |
+---------------------+
| addressbook_service |
| information_schema  |
| mysql               |
| payroll_service     |
| performance_schema  |
| sys                 |
+---------------------+
6 rows in set (0.00 sec)

mysql> USE addressbook_service;
Database changed

mysql> select database();
+---------------------+
| database()          |
+---------------------+
| addressbook_service |
+---------------------+
1 row in set (0.00 sec)

*************************************************************************************************************************************************************
UC2 :-Ability to create a Address Book Table with first and last names, address, city, state, zip, phone number and email as its attributes

mysql> CREATE TABLE addressbook
    -> (
    -> first_name               VARCHAR(20) NOT NULL,
    -> last_name                VARCHAR(20) NOT NULL,
    -> address                  VARCHAR(50) NOT NULL,
    -> city                     VARCHAR(20) NOT NULL,
    -> state                    VARCHAR(20) NOT NULL,
    -> zip_code                 VARCHAR(6)  NOT NULL,
    -> phone_number             VARCHAR(20) NOT NULL,
    -> email                    VARCHAR(80) NOT NULL,
    -> PRIMARY KEY              (first_name)
    -> );
Query OK, 0 rows affected (17.44 sec)

mysql> DESCRIBE addressbook;
+--------------+-------------+------+-----+---------+-------+
| Field        | Type        | Null | Key | Default | Extra |
+--------------+-------------+------+-----+---------+-------+
| first_name   | varchar(20) | NO   | PRI | NULL    |       |
| last_name    | varchar(20) | NO   |     | NULL    |       |
| address      | varchar(50) | NO   |     | NULL    |       |
| city         | varchar(20) | NO   |     | NULL    |       |
| state        | varchar(20) | NO   |     | NULL    |       |
| zip_code     | varchar(6)  | NO   |     | NULL    |       |
| phone_number | varchar(20) | NO   |     | NULL    |       |
| email        | varchar(80) | NO   |     | NULL    |       |
+--------------+-------------+------+-----+---------+-------+
8 rows in set (2.72 sec)

*************************************************************************************************************************************************************
UC3 :- Ability to insert new Contacts to Address Book

mysql> INSERT INTO addressbook VALUES
    -> ('Shaheen','Miya','Rainbow Environ Colony','Pune','Maharashta','411001','9922178220','shaheen5@gmail.com'),
    -> ('Uthsavi','Gowda','North Street','Bangalore','Karnataka','312031','7984578220','utsavi57@gmail.com'),
    -> ('Rahul','sharma','Gandhi Nagar','Mumbai','Maharashtra','411015','9922789009','rahul777@gmail.com'),
    -> ('Pallavi','Chaudhary','Kalyani Nagar','Ahmedabad','Gujarat','202100','7447438788','pallavi123@yahoo.in'),
    -> ('Shubham','Kadam','Vishrantwadi Kalas Road','Pune','Maharashta','411015','9321378220','shubhs@yahoo.in');
Query OK, 5 rows affected (0.60 sec)
Records: 5  Duplicates: 0  Warnings: 0

mysql> SELECT * FROM addressbook;
+------------+-----------+-------------------------+-----------+-------------+----------+--------------+---------------------+
| first_name | last_name | address                 | city      | state       | zip_code | phone_number | email               |
+------------+-----------+-------------------------+-----------+-------------+----------+--------------+---------------------+
| Pallavi    | Chaudhary | Kalyani Nagar           | Ahmedabad | Gujarat     | 202100   | 7447438788   | pallavi123@yahoo.in |
| Rahul      | sharma    | Gandhi Nagar            | Mumbai    | Maharashtra | 411015   | 9922789009   | rahul777@gmail.com  |
| Shaheen    | Miya      | Rainbow Environ Colony  | Pune      | Maharashta  | 411001   | 9922178220   | shaheen5@gmail.com  |
| Shubham    | Kadam     | Vishrantwadi Kalas Road | Pune      | Maharashta  | 411015   | 9321378220   | shubhs@yahoo.in     |
| Uthsavi    | Gowda     | North Street            | Bangalore | Karnataka   | 312031   | 7984578220   | utsavi57@gmail.com  |
+------------+-----------+-------------------------+-----------+-------------+----------+--------------+---------------------+
5 rows in set (0.91 sec)

***************************************************************************************************************************************************************
C4 :- Ability to edit existing contact person using their name

mysql> UPDATE addressbook SET zip_code = '211222' WHERE first_name = 'Uthsavi';
Query OK, 1 row affected (1.66 sec)
Rows matched: 1  Changed: 1  Warnings: 0

mysql> UPDATE addressbook SET phone_number = '9922167220' WHERE first_name = 'Shaheen';
Query OK, 1 row affected (0.15 sec)
Rows matched: 1  Changed: 1  Warnings: 0

mysql> SELECT * FROM addressbook;
+------------+-----------+-------------------------+-----------+-------------+----------+--------------+---------------------+
| first_name | last_name | address                 | city      | state       | zip_code | phone_number | email               |
+------------+-----------+-------------------------+-----------+-------------+----------+--------------+---------------------+
| Pallavi    | Chaudhary | Kalyani Nagar           | Ahmedabad | Gujarat     | 202100   | 7447438788   | pallavi123@yahoo.in |
| Rahul      | sharma    | Gandhi Nagar            | Mumbai    | Maharashtra | 411015   | 9922789009   | rahul777@gmail.com  |
| Shaheen    | Miya      | Rainbow Environ Colony  | Pune      | Maharashta  | 411001   | 9922167220   | shaheen5@gmail.com  |
| Shubham    | Kadam     | Vishrantwadi Kalas Road | Pune      | Maharashta  | 411015   | 9321378220   | shubhs@yahoo.in     |
| Uthsavi    | Gowda     | North Street            | Bangalore | Karnataka   | 211222   | 7984578220   | utsavi57@gmail.com  |
+------------+-----------+-------------------------+-----------+-------------+----------+--------------+---------------------+
5 rows in set (0.00 sec)

mysql> UPDATE addressbook SET state = 'Maharashtra' WHERE first_name = 'Shaheen' or first_name = 'Shubham';
Query OK, 2 rows affected (0.10 sec)
Rows matched: 2  Changed: 2  Warnings: 0

mysql> SELECT * FROM addressbook;
+------------+-----------+-------------------------+-----------+-------------+----------+--------------+---------------------+
| first_name | last_name | address                 | city      | state       | zip_code | phone_number | email               |
+------------+-----------+-------------------------+-----------+-------------+----------+--------------+---------------------+
| Pallavi    | Chaudhary | Kalyani Nagar           | Ahmedabad | Gujarat     | 202100   | 7447438788   | pallavi123@yahoo.in |
| Rahul      | sharma    | Gandhi Nagar            | Mumbai    | Maharashtra | 411015   | 9922789009   | rahul777@gmail.com  |
| Shaheen    | Miya      | Rainbow Environ Colony  | Pune      | Maharashtra | 411001   | 9922167220   | shaheen5@gmail.com  |
| Shubham    | Kadam     | Vishrantwadi Kalas Road | Pune      | Maharashtra | 411015   | 9321378220   | shubhs@yahoo.in     |
| Uthsavi    | Gowda     | North Street            | Bangalore | Karnataka   | 211222   | 7984578220   | utsavi57@gmail.com  |
+------------+-----------+-------------------------+-----------+-------------+----------+--------------+---------------------+
5 rows in set (0.00 sec)

****************************************************************************************************************************************************************
UC5 :- Ability to delete a person using person's name

mysql> DELETE FROM addressbook WHERE first_name = 'Rahul';
Query OK, 1 row affected (0.18 sec)

mysql> SELECT * FROM addressbook;
+------------+-----------+-------------------------+-----------+------------+----------+--------------+---------------------+
| first_name | last_name | address                 | city      | state      | zip_code | phone_number | email               |
+------------+-----------+-------------------------+-----------+------------+----------+--------------+---------------------+
| Pallavi    | Chaudhary | Kalyani Nagar           | Ahmedabad | Gujarat    | 202100   | 7447438788   | pallavi123@yahoo.in |
| Shaheen    | Miya      | Rainbow Environ Colony  | Pune      | Maharashta | 411001   | 9922167220   | shaheen5@gmail.com  |
| Shubham    | Kadam     | Vishrantwadi Kalas Road | Pune      | Maharashta | 411015   | 9321378220   | shubhs@yahoo.in     |
| Uthsavi    | Gowda     | North Street            | Bangalore | Karnataka  | 211222   | 7984578220   | utsavi57@gmail.com  |
+------------+-----------+-------------------------+-----------+------------+----------+--------------+---------------------+
4 rows in set (0.63 sec)

*********************************************************************************************************************************************************

